process,step,Hongming,Haoyu,Yuqian,ground_true_relabel,id
Switch Medicare from One State to Another - Moving with a Medigap Plan,Check with your current insurance company,1,1,1,1,1424
Stretch the Calf Area of Boots - Stretching Boots with Boot Bands,Place the boot band zip next to the zip on your boot,1,1,1,1,1425
Use an Analog Watch as a Compass - In the Northern Hemisphere,Point the hour hand in the direction of the sun,1,1,1,1,1426
Store Avocado - Packaging a Cut Avocado,Place avocado in a dish.,1,1,1,1,1427
Get a Dog to Stop Drinking from the Toilet - Training Your Dog,Call it from the area,1,1,1,1,1429
Remove Vocals from Songs - Removing the Center Channel,Locate the vocals in the mix,1,1,1,1,1430
Use a GoPhone Plan With an iPhone - iPhone through iPhone 3GS,Remove the iPhone SIM card,0,0,0,0,1433
Prepare a Power of Attorney - Preparing a Power of Attorney Document,Check your state’s requirements,1,1,1,1,1434
Paint Bamboo Furniture - Painting the Furniture,Let the spray paint dry ,1,1,1,1,1435
Have Assault Charges Dropped - Taking Preliminary Steps,Seek legal advice,1,1,1,1,1436
Find the Flashlight on an iPhone - Using Control Center,One should swipe up from a edge of the screen to open Control Center on your iPhone.,1,1,1,1,1437
Pay Your Taxes - Submitting Payment through the Mail,Verify the amount of tax that you owe,1,0,1,1,1439
Strap a Thumb - Getting Ready to Strap Your Thumb,Acquaint yourself with different types of thumb straps,1,1,1,1,1440
Make Soursop Juice - Mashing the Soursop,Wash the soursop under running water,0,0,1,0,1441
Find Perfect Ice Skates,Consider what kind of skating you do,1,1,1,1,1442
Draw Skylanders - Hex,Erase auxiliary lines,1,0,1,1,1443
Peel a Pumpkin - Peeling with a Vegetable Peeler,Cut the rounded top and bottom off of the pumpkin to create flat surfaces,1,0,1,1,1444
Flat Iron Hair - Learning the Technique,Clamp the iron down,0,1,1,1,1447
Build a Home Studio for Computer Based Music Recording - Building a Home Studio,Select a room in your house,1,1,1,1,1448
Become a Registered Nurse - Obtaining the Correct Education and Credentials,Find a job as a nurse,1,1,1,1,1449
Make a Garden Flag,Prevent the flag from twisting and turning by weighing it down,0,0,0,0,1450
Use Microsoft Paint in Windows - Adding Text,Change the text's font,0,0,0,0,1452
Open CSV Files - OpenOffice Calc,Download and open OpenOffice Calc,0,1,1,1,1453
Report a Fake Account on Facebook - Using the Mobile App,Block profile,1,1,0,1,1455
Create a Macaron Cake - Assembling the Cake,Fill the center of the ring with sliced strawberries,0,0,0,0,1456
Find the Surface Area of a Pyramid - Finding the Surface Area of a Square Pyramid,Square the side length of the base,1,1,1,1,1457
Post Process Smoke Images - Mirroring Your Smoke,Duplicate the layer and flip it so that it is 'reflected',0,0,0,0,1458
Clear Your Browser's Cache - Firefox on Desktop,Select a time range,1,0,1,1,1461
Deal With a Lying Child - Handling Lying in Adolescents (ages 10 and up),Follow through on punishments,0,1,1,1,1464
Polish Chrome Wheels - Cleaning Your Wheels,Rinse your wheels off to remove the soap residue,1,1,1,1,1465
Make a Motion at a Board of Directors Meeting - Reaching a Resolution,Vote on the motion,1,1,1,1,1468
Create MP3 Files from Wikipedia Articles Using Pediaphon - Setting Up the Article to Covert,Type in the search bar the name of the article you want to convert into an MP3 audio file,0,1,1,1,1470
Make Sweet Curry Powder,Pour into a suitable airtight container for storage,1,0,1,1,1471
Write Headings for an Article - Writing Headings for APA Articles,Write a level five heading,0,0,0,0,1472
Make Spring Rolls - Cooking Thai Fresh Rolled,Divide the flour mixture into 3 cups of droplets of food coloring,1,1,0,1,1475
Separate Sand and Salt - Carrying Out the Experiment,Strain the saltwater from the sand using a coffee filer and funnel,1,1,1,1,1476
Create MP3 Files from Wikipedia Articles Using Pediaphon - Setting Up the Article to Covert,Choose the country you are in.,0,0,0,0,1477
Seed a Pomegranate By Hand - Removing Seeds in Water,Fill water,1,1,1,1,1478
Cook Hot Dogs - Frying Hot Dogs,Turn the hot dog pieces,1,1,1,1,1480
Make German Chocolate Caramel Brownies,Remove from heat and set aside,1,1,1,1,1481
Make a Good Pot of Coffee - Brewing the Coffee,Place a filter inside the machine over the coffee pot,1,1,1,1,1486
File for a K1 Visa - Filing Your Petition with USCIS,Gather necessary documents to support the petition,1,1,1,1,1487
Pick out Your Perfect Cell Phone," Look at this phone long and hard and think ""Am I going to want this phone in a year?"" Enjoy your new phone!",0,0,0,0,1488
Use Microsoft Paint in Windows - Adding Text,Anchor your text,1,1,1,1,1489
Sew in a Lace Closure for Your Hair - Sewing in the Wefts,Sew your final weft over the lace closure's edge,1,1,1,1,1490
Repair Torn Leather - Filling the Seam in the Tear,Wait 24 hours to give the glue and filler time to dry,1,1,1,1,1491
Deal With a Lying Child - Handling Lying in Adolescents (ages 10 and up),Ask your child why they choose to lie and listen,1,1,1,1,1492
Make Your Mobile Phone Number Appear As a Private Number - Asking Your Carrier To Make Your Number Private,Ask the customer service representative to make your number private,0,0,1,0,1494
Use Instacart on an iPhone or iPad,Watch out for Instacart-only coupons in the Coupons tab,0,0,0,0,1496
Print Wirelessly from an iPad with HP Eprint App - Linking a Printer,Search for a printer,1,1,1,1,1498
Kill English Ivy - Killing Ivy on Trees,Examine the tree trunk for uncut vines,0,1,1,1,1499
Build a Go Kart - Mounting the Engine and Steering Column,Double check your brakes and suspension system before test-driving,0,0,1,0,1501
Boil Cabbage - Boiling the Cabbage,Bring water to a gentle boil over medium-high heat,1,1,1,1,1503
Clean Rust Off Cast Iron - Using Vinegar,Mix white vinegar and water,1,1,1,1,1504
Create a Chocolate Rose Arrangement - Making the Chocolate Roses,keep it into bowl,1,1,1,1,1505
Collect Sperm for Analysis - Ensuring an Accurate Analysis,Clean your hands and penis beforehand with water and dry thoroughly,0,0,1,0,1507
Unhook a Bra - Unhooking Someone Else’s Bra,Slide the right side (i,0,0,0,0,1508
Create a Fillable PDF - Editing Form Fields,Click the Text Field tool to add a new field,1,0,1,1,1509
Cover Dining Room Chairs - Covering Chairs with Store-Bought Slipcovers,Decide what parts of your chair you want to cover,1,1,1,1,1510
Get a Japanese Passport - Getting Your Passport,Choose the type of passport you want,1,1,1,1,1512
Use Antiseizure Medications for Anxiety - Using Medication Responsibly,Choose an appropriate medication,1,1,1,1,1513
Keep Japanese Weather Loaches - Setting up Your Aquarium,Purchase a tank with 40 US gal (150 L) of space and a 4 ft (1,0,0,0,0,1514
Make Vegetable Fritters - Making Gluten Free Vegetable Fritters,Serve the fritters,1,0,0,0,1515
Make a Putting Green - Constructing Your Green,Separate your green to protect against weeds,1,1,1,1,1516
Tell If Someone Is in Your Closet,Listen for any rustling or breathing from the closet,1,1,1,1,1517
Make a Vanilla Cake - Basic Vanilla Cake,Enjoy!,0,0,0,0,1518
Copy Text from a PDF to a Word Doc - Using Adobe Acrobat Reader for Windows or macOS,Select the text in the document,1,1,1,1,1519
Toast Sunflower Seeds - Microwave Toasting,Sprinkle salt or any other seasoning lightly on the sunflower seeds.,1,1,1,1,1520
Open CSV Files - OpenOffice Calc,Click on the “File” menu and select “Open,1,0,0,0,1521
Gently Curl Your Hair - Using a Headband,Let your hair dry completely,1,0,0,0,1523
Identify Songs Using Melody - Using Technology,Include any additional details you can think of,1,1,1,1,1524
Paint Patio Furniture - Refinishing Rusty Metal Furniture,Use muriatic acid or another rust remover to get areas of stubborn rust,1,1,1,1,1525
Use a VCR for Extended Recording of Radio Talk Shows," Turn off TV and VCR - leave radio on and connected to L1 After recording has finished, rewind tape, turn TV on and press Play on VCR to listen to recording",0,0,0,0,1526
File a Case in Consumer Court - Resolving Your Case,Present your case at your second hearing,1,1,1,1,1527
Make Vegetarian Yakisoba, Add and sitr-fry noodles,1,1,1,1,1529
Grow Birch Trees - Planting the Birch Tree," Choose a planting location with moist, slightly-acidic soil",1,1,1,1,1530
Drink Bombay Sapphire - Making a Gin and Tonic,1 Lemon peel and lemon wedge,0,0,0,0,1531
Calculate Bond Discount Rate - Calculating the Present Value of the Bond's Principal,Calculate the Present Value Interest Factor (PVIF),1,1,1,1,1532
Use Instacart on an iPhone or iPad,Open Instacart on your iPhone or iPad and log in to the app if you haven't done so already,1,1,1,1,1533
Dry a Dog - Drying Your Dog With a Chamois,Rub the dog's coat with the chamois,1,1,1,1,1534
Pay Your Taxes - Submitting Payment through the Mail,Follow up to make sure your payment is received,1,1,1,1,1535
Upload and Download Files on Gavitex - Downloading Files,Download files,0,1,1,1,1536
Kill Ants in Your House - Eliminating a House Ant Colony,Keep the bait stations in place until all ant activity has ceased,0,1,1,1,1537
Catalogue Your Books with Goodreads - Adding Shelves to Your Virtual Bookshelf,View your bookshelf,1,1,1,1,1540
Draw Skylanders - Hex,Add details on her body and costume,0,1,1,1,1541
Teach a Child to Use the Telephone,Let your child begin to call his/her friends/relatives,1,1,1,1,1542
Keep Japanese Weather Loaches - Setting up Your Aquarium,Install an under-gravel or power filter,0,0,0,0,1543
Clean a Dog's Wound - Seeking Professional Veterinary Help,Seek veterinary help for all bite wounds,0,0,0,0,1544
Make a Putting Green - Constructing Your Green,Ready the soil,0,0,0,0,1545
Make Sweet Curry Powder,"If using fresh spices, grind or mill them in readiness",1,1,1,1,1546
Check Traffic - Checking Traffic with Google Maps,Type in your destination,1,1,1,1,1548
Find the Surface Area of a Pyramid - Finding the Surface Area of a Square Pyramid,Multiply the side length of the base by the slant height and divide by two,1,1,1,1,1549
Toast Sunflower Seeds - Microwave Toasting, Use microwave,1,1,1,1,1550
Construct a Raised Planting Bed - Constructing the Frame,Loosen the soil underneath the removed turf,0,0,0,0,1551
Sharpen a Swiss Army Knife - Finishing Up,Select the proper coarseness for your sharpening stone. ,1,1,1,1,1554
Decorate Garden Stones - Organizing Your Project,Buy the right paint and sealant for outdoor stones,1,1,1,1,1557
Hang Floating Shelves - Installing Cleats,Push the shelf onto the cleat,1,1,1,1,1559
Reset Browser Settings - Firefox,Open Firefox,0,1,1,1,1560
Get an Article Approved in wikiHow's Quality Review,Review for final edits,1,1,1,1,1561
Make Pickles - Simple Pickles,Make pickling liquid,1,1,1,1,1562
Make Pickles - Simple Pickles,Gather your ingredients,1,1,1,1,1563
Find Fulfilling Work - Finding a Possible Career Path,Accept the confusion,0,0,0,0,1564
Get Dog Urine Smell out of Carpets - Cleaning with Vinegar and Baking Soda,Mix together water and white vinegar in a spray bottle,1,1,1,1,1566
Check Traffic - Checking Traffic with Google Maps,"Select ""Traffic""",1,1,1,1,1567
Install Internet Explorer - Using Windows 10,Click Download Internet Explorer ,1,1,1,1,1568
Get Dog Urine Smell out of Carpets - Cleaning with Vinegar and Baking Soda,Spray the mixture on the urine stain and let it sit for 15 minutes,1,1,1,1,1569
Construct a Raised Planting Bed - Constructing the Frame,Cut your timbers to the desired length,0,1,1,1,1570
Store Collard Greens - Storing Fresh Collard Greens,Refrigerate the collard greens,1,1,1,1,1573
Have Assault Charges Dropped - Taking Preliminary Steps,Think over your decision,1,1,1,1,1574
Use Microsoft Publisher - Saving Your Document,Click on “Save,0,0,1,0,1575
Cook Hot Dogs - Frying Hot Dogs,Serve the hot dogs,0,0,0,0,1576
Make a Concept Map - The Spider Concept Map,Write the main topic in the center,1,1,1,1,1577
Draw Cute Animals - A Cute Tiger,Draw a square,0,0,0,0,1578
Reset Browser Settings - Firefox,Click the menu button,0,1,1,1,1581
Measure Helmet Size - Trying on a Helmet,Determine helmet type,0,0,0,0,1583
Change Your General Preferences on Safari - iOS,"Switch your Favorites folder with the ""Favorites"" option",0,0,0,0,1584
Make Pickles - Simple Pickles,Layer the cucumbers and onions in a container,1,1,1,1,1585
Make a Camo Cake - Baking the Cake,Buy cake mix and food coloring gel.,1,1,1,1,1586
Clean a Granite Sink - Removing Hard Water Stains,Scrub the sink,1,1,1,1,1587
Survive in the Woods - Starting a Fire,Gather small twigs and branches to use for kindling,1,1,1,1,1589
Use a GoPhone Plan With an iPhone - iPhone through iPhone 3GS,Power down your iPhone,0,0,1,0,1591
Remove Wrinkles from Leather Jackets - Steaming the Jacket,Turn on your shower,0,0,0,0,1592
File for a K1 Visa - Filing Your Petition with USCIS,Mail your package of documents to USCIS,1,1,1,1,1594
Make Spring Rolls - Cooking Thai Fresh Rolled," Mix coconut milk, salt and coconut sugar",1,0,0,0,1595
Make a Good Pot of Coffee - Brewing the Coffee,Serve and enjoy the coffee while it’s hot,0,0,0,0,1596
Dry Sage - Drying Sage in a Food Dehydrator,Spread out the leaves on a tray in a single layer,1,0,1,1,1597
Bake a Cake - Making Apple Cake,Add the dry mixture to the wet mixture,1,1,1,1,1598
Make a Tight Turn Quickly in a Car - Using Your Handbrake,Check all your mirrors to make sure that you’re clear. Before you shift lanes or start to turn,1,1,1,1,1601
Preserve a Butterfly - Mounting Your Butterfly,Hold the wings flat ,1,1,1,1,1604
Diagnose a Yeast Infection at Home - Using a Home Test Kit,Read the manufacturer's instructions and wash your hands,0,0,1,0,1605
Make Shrimp Chef Salad with Lime and Cilantro,Hard boil the eggs,1,1,1,1,1606
Talk About Daily Stress with Your Partner - Having Daily Conversations,Discuss your stress temperature,1,1,1,1,1609
Play Roller Derby - Starting the Jam,Start a new jam after 1 jam ends,0,0,1,0,1612
Make Vegetable Fritters - Making Gluten Free Vegetable Fritters,"Wash, peel, and grate the zucchinis",1,1,1,1,1614
Become a Registered Nurse - Obtaining the Correct Education and Credentials,Make sure your school is accredited,1,1,1,1,1616
Change Your General Preferences on Safari - iOS," Tap ""Passwords"" to view your stored passwords",0,0,0,0,1617
Know when to Use Oil Based Paint Instead of Latex,Know the stores which sell both Oil Based Paint and Latex,0,0,0,0,1618
Get Notified of Changes to a Dropbox on Android,Open Dropbox on Andoid,1,1,0,1,1620
Undo a Bra One Handed - Familiarizing Yourself with a Bra,Find a bra you can use for practice,1,1,1,1,1621
Buy a Harley Davidson - Considering a Used Harley-Davidson,Find the current market value of the specific model you're considering,1,1,1,1,1623
Connect a HyperX Cloud Headset - Connecting to Mobile Device,Connect the headset to the control box,1,1,1,1,1625
Password Protect a PDF - Using PDF2Go,select the option to set paswaord,1,1,1,1,1626
Sign Up for a US Trusted Traveler Program - Signing up for NEXUS,Attend your appointment,1,1,1,1,1627
Use Excel - Creating Charts,Change your chart's axis titles,0,0,0,0,1628
Print Wirelessly from an iPad with HP Eprint App - Linking a Printer,Turn on the printer,1,1,1,1,1629
Pick out Your Perfect Cell Phone,Consider the price and the functionality of a phone ,0,1,1,1,1630
Make Curly Fries - Baking the Fries,Bake to preferred crispiness,1,1,1,1,1631
Change the Root Password in Linux - With the Current Root Password," Type the current root password, then press ↵ Enter",1,1,1,1,1633
Remove Vocals from Songs - Removing the Center Channel,Customize the frequency range of the vocal ,1,1,1,1,1634
Get an Article Approved in wikiHow's Quality Review,Ask someone to take another look at the article after you've added to it,0,0,0,0,1635
Delete Bookmarks - Firefox,Expand the categories to see your bookmarks,1,1,1,1,1636
Password Protect a PDF - Using PDF2Go,Enter an editing password,1,1,1,1,1637
Whittle a Ball in a Cage - With Hand Tools,Turn the block over and repeat,1,1,1,1,1638
Cite a Syllabus in APA - Integrating an In-Text Citation,Set off direct quotes with quotation marks,0,0,1,0,1639
Play Chopsticks on a Keyboard or Piano - Playing the Song,Play the first measure,1,1,0,1,1640
Create a Kahoot Game,Click to choose a template or create a new game from scratch,1,1,1,1,1642
Clean Your Dog's Toothbrush - Disinfecting the Toothbrush,Add lemon juice to the water,1,1,0,1,1643
Write a Customer Relationship Management Plan - Writing Your CRM Plan,Determine who in the company will be responsible for each part of your CRM plan,1,1,1,1,1644
Be Ready and Comfortable Kissing a Guy,Start by cuddling,0,0,0,0,1645
"Add Colorful Emoticons, Icons and Smiley Faces in Outlook","Go to ""New"" button and create a new message (email)",0,0,0,0,1646
Bake Halibut - Parchment Baked Halibut,Arrange the aromatics on top,1,1,1,1,1647
Transfer Nokia Contacts to a Samsung - Syncing Google Contacts,Tap to turn the switch on next to “Contacts,0,0,0,0,1648
Apply for a Marriage License in Kentucky - Getting a Marriage License in Kentucky if Both Parties are over 18,Complete the marriage license application form,1,1,1,1,1649
Gently Curl Your Hair - Using a Headband,Shake out and style your curls,1,1,1,1,1652
Play French Darts,Keep playing until you have a winner,0,0,0,0,1653
Build a DIY Picture Frame Shelf - Making a Gallery Ledge Shelf,Align and fasten your 1x4 boards,1,1,1,1,1654
Make Soursop Juice - Mashing the Soursop,Wash the fruit,1,1,1,1,1655
Dispose of Coffee Grounds - Making a Compost Heap,Place a large lidded compost bin in a shaded dry spot,1,1,1,1,1656
File a Complaint Against an Arizona Real Estate Agent - Complaining to the Arizona Department of Real Estate,Provide copies of all related documents,1,1,1,1,1657
Clean Ears with Peroxide - Setting Up,Warm the oil and peroxide,1,0,0,0,1659
Make Your Mobile Phone Number Appear As a Private Number - Asking Your Carrier To Make Your Number Private,Open the phone app,0,0,0,0,1660
Draw Skylanders - Hex,"Near the topmost and center of the paper, draw a circle for her head",0,0,0,0,1661
Preserve Lemons - Prepping the Lemons,Choose ripe Meyer lemons,0,0,0,0,1662
Hug Your Boyfriend - Hugging Your Boyfriend Properly," Gently squeeze him, and press your body against his",0,0,0,0,1664
Give Flat Hair Volume - Drying Your Hair to Add Volume,Flip your hair upside-down,1,1,1,1,1665
Find a Nursing Home for a Senior - Getting Set up in the Nursing Home,Fill out the admissions paperwork,1,1,1,1,1667
Brown a Roast for Cooking in a Crockpot,Place the meat on a cutting board,0,0,0,0,1669
Recognize and Treat Postpartum Psychosis - Diagnosing Postpartum Psychosis,Rule out potential medical causes,1,0,0,0,1670
Field Dress a Deer - Removing the Entrails,Cut all the way up the deer’s midline without piercing the entrails,1,1,1,1,1671
Make Banana Walnut Cake Pops - Decorating the Cake Balls,Chill the cake balls ,1,1,1,1,1672
Blow Dry Layered Hair - Blow Drying Short Layers,Blow dry from roots to tips,1,1,1,1,1673
Blow Dry Layered Hair - Blow Drying Short Layers,Pat your hair dry with a towel if necessary,1,1,1,1,1674
Calculate the Volume of a Cube - Finding Volume from Surface Area,Divide the cube's surface area by 6,0,0,0,0,1677
Make a Good Pot of Coffee - Brewing the Coffee,Select how much coffee you want to make,1,1,1,1,1678
Alleviate Headaches During Pregnancy - Recognizing More Serious Problems,Recognize the signs of pre-eclampsia,1,1,1,1,1679
Make Straight Cuts with a Circular Saw - Constructing and Using a Straight Edge,Raise and measure the board you wish to cut with the straight edge,1,1,1,1,1680
Be Ready and Comfortable Kissing a Guy,Close the eyes,0,0,0,0,1681
Dry a Dog - Drying Your Dog With a Chamois,Pet your dog.,1,1,0,1,1683
Dry Sage - Drying Sage in a Food Dehydrator,Set your dehydrator on a appropriate temperature,1,1,1,1,1685
Use Instacart on an iPhone or iPad,Make sure the device is connecting to internet,0,1,1,1,1686
Hug Your Boyfriend - Hugging Your Boyfriend Properly,Make sure that you look good and smell nice,1,1,1,1,1688
Construct a Raised Planting Bed - Constructing the Frame,Dig a trench,1,1,1,1,1689
Password Protect a PDF - Using PDF2Go,Select your PDF,1,1,1,1,1691
Use Bing Maps - Viewing Maps,Download the Bing Maps app,1,1,0,1,1692
Promote Root Growth - Encouraging Growth in Cuttings,Place the cutting in an area with bright light,1,0,0,0,1693
Cook Goose Breasts - Pan-Roasted Goose Breasts,Preheat the oven and cut slashes across the skin,1,1,1,1,1694
Make Curly Fries - Baking the Fries,Toss in oil,1,1,1,1,1695
Reset Browser Settings - Firefox,Press the Reset Firefox,1,1,1,1,1696
Bake Eggs - Making Shirred Eggs," Season the eggs with salt, pepper, and grated cheese, if desired",0,0,0,0,1697
Install Popup Camper Air Conditioner Roof Supports - Completing the Installation,Prepare appropriate tool sets,1,1,1,1,1698
Store Collard Greens - Storing Fresh Collard Greens,Wash before preparing,1,1,1,1,1699
Update Your Vehicle Registration - Changing Your Name,Visit your local DMV,1,0,0,0,1701
Get a Federal Explosives License - Submitting a Complete Application,Receive a response,1,1,1,1,1702
Give Flat Hair Volume - Drying Your Hair to Add Volume,Scrunch your hair,1,1,1,1,1703
Service an Air Conditioner - Clean the Air Conditioner,Cover the motor and wiring with a sheet,1,1,1,1,1705
Boil Cabbage - Boiling the Cabbage,Season the cabbage,1,0,1,1,1706
Store Collard Greens - Storing Fresh Collard Greens,Do not wash the collard greens,1,0,0,0,1707
Cook Diced Beef - Sautéing Diced Beef,Warm your diced beef,1,1,1,1,1708
File for a K1 Visa - Filing Your Petition with USCIS,Get a check or money order for the filing fee,1,1,1,1,1710
Glue Fabric to a Hat Frame," Be sure material has adhered to frame on each space glued, before going on to the next space",1,1,1,1,1712
Clean a Granite Sink - Removing Hard Water Stains,Apply olive or mineral oil to a cloth,1,1,0,1,1713
Write a Customer Relationship Management Plan - Writing Your CRM Plan,Consider using a CRM plan template,0,0,0,0,1714
"Cut a Cabbage Into Wedges - Cutting Long, Skinny Cabbage",Remove the outer leaves,0,0,0,0,1715
Stop Hormone Replacement Therapy (HRT) - Stopping Hormones,Follow your doctor's instruction,1,1,1,1,1717
Copy Text from a PDF to a Word Doc - Using Adobe Acrobat Reader for Windows or macOS,Open your PDF in Acrobat Reader,1,1,1,1,1718
Separate Sand and Salt - Carrying Out the Experiment,Heat the salt water until the water boils. Continue boiling it until the water is gone and you're left with the salt.,1,1,1,1,1720
Get Dog Urine Smell out of Carpets - Cleaning with Vinegar and Baking Soda,Cover the vinegar solution with baking soda to deodorize your carpet,1,1,0,1,1721
Defrost Salmon - Thawing in Cold Water,Thaw the salmon under cold water for up to 1 hour before cooking it,0,0,1,0,1722
Fix a Bicep Tear - Resuming Physical Activity,Do 10 supination and pronation stretches,0,0,0,0,1723
Get an Article Approved in wikiHow's Quality Review," Keep editing the article until it's as helpful, detailed and in-depth as you think it can possibly be",0,0,1,0,1724
"Cut a Mat Using a Utility Knife - Planning, Drawing Guide Lines and Cutting the Board to Size",Find a sturdy surface for mat cutting,1,1,1,1,1725
Cook Brazilian Rice - Method One: Traditional Brazilian Rice,Simmer until done,0,0,1,0,1728
Find Fulfilling Work - Finding a Possible Career Path,Identify barriers preventing you from being who you want to be,1,1,1,1,1729
Glue Fabric to a Hat Frame,Cover the surface of the hat frame where the fabric is to be applied with glue,1,1,1,1,1730
Row on a Rowing Machine - Completing the Movement,Set appropriate weight,1,1,1,1,1732
Stay Organized when Moving,Make up the boxes,1,1,1,1,1733
Be a Good Hamster Owner (for Kids) - Cleaning Your Hamster’s Cage,Restock the bedding and replace toys and other objects,0,0,0,0,1734
Use Excel - Creating Charts,Click Recommended Charts,0,0,0,0,1735
Peel a Kiwi - Peeling kiwifruit with a spoon,"One should wash Kiwi before cut off both ends ,",0,1,1,1,1736
Keep a Pet Snail - Making a Habitat,ensure snail has adequate food and water,1,1,1,1,1737
"Create a Go Kart with a Lawnmower Engine - Assembling Motor Mount, Brake Rod, and Accessories",Put in the brake rod guide tab,1,1,1,1,1738
Get Married in Oregon - Planning a Wedding Ceremony,Choose a season,1,1,1,1,1739
Download Kindle Books on an iPad - Adding Non-Kindle Content to Your Kindle App,Download and install the transfer software for your computer,1,1,0,1,1740
Clean Skylights - Cleaning Skylights from the Outside,Climb down the ladder and spray down the skylight with a hose,1,0,0,0,1742
Apologize After a Heated Argument - Re-establishing Trust After an Argument,Consummate the apology,0,0,0,0,1744
Write a Customer Relationship Management Plan - Writing Your CRM Plan,Include financial and time budgets for your CRM plan,1,1,1,1,1745
Paint Patio Furniture - Refinishing Rusty Metal Furniture,Buy rust-inhibiting spray primer and paint,1,1,1,1,1748
Sell Crafts Online Easily - Launch Your Website,Include a contact form so that buyers can reach you for questions and special order requests,1,1,1,1,1750
Apply for a Job in Canada - Applying and Interviewing,Fill out the job application completely and honestly,1,1,1,1,1752
Play Chopsticks on a Keyboard or Piano - Playing the Song,Play the E and G notes,0,0,0,0,1753
Make a Balloon Pet - Balloon stress relief pet,Choose a balloon color,0,0,0,0,1754
Open XML - Using a Text Editor,Interpret the text on the screen,0,0,0,0,1755
Make German Chocolate Caramel Brownies,Bake the brownies,1,1,1,1,1756
Make Banana Walnut Cake Pops - Decorating the Cake Balls,Use the walnut pieces on the cake balls,1,1,1,1,1758
Find Surface Area of a Triangular Prism - Finding the Lateral Area,Find a formula to calculate the lateral area of a triangular prism,1,1,1,1,1759
