process,step,Hongming,Haoyu,Yuqian,ground_true_relabel,id
Change Your General Preferences on Safari - iOS," Choose how links are opened with ""Open Links",1,1,0,1,1098
Style Waist Length Hair - Getting Creative with Chopsticks and Braids,Put the top half of your hair in a ponytail,0,1,0,0,1100
Use Google Keyword Planner - Using the New Keyword Search,Customize your search,1,1,1,1,1101
Clean a Granite Sink - Removing Hard Water Stains," Dry the sink using a dry, soft microfiber towel",1,1,0,1,1102
Cook Brazilian Rice - Method One: Traditional Brazilian Rice,Let the rice brown,0,-1,0,0,1103
Promote Root Growth - Encouraging Growth in Cuttings,Take a 2 to 3 in (51 to 76 mm) cutting from a healthy plant,1,2,1,1,1105
"Cut a Cabbage Into Wedges - Cutting Long, Skinny Cabbage",Know which varieties of cabbage this applies to,1,-1,1,1,1106
Polish Chrome Wheels - Cleaning Your Wheels,Dry your wheels off using compressed air or a clean cloth,0,0,1,0,1107
Manage a Disciplinary Meeting - Calling a Disciplinary Meeting,Give the employee written notice of the meeting,1,-1,1,1,1109
Clean Under Laptop Keyboard Keys - Putty,Buy special cleaning putty,1,0,1,1,1110
Download Google Docs - On Desktop,Select Download as,1,1,1,1,1111
Pick out Your Perfect Cell Phone,first of all as our convenient and our wish first choose best mobile then check it all necessary needs in mobile,1,1,1,1,1112
Create a Kahoot Game,click login,1,1,1,1,1113
Pasteurize - Using Direct Heat to Pasteurize,Pour the food or liquid you want to pasteurize into sterilized containers,1,1,1,1,1114
Make Rainbow Frosting - Skittles Rainbow Frosting,Allow the melted Skittles to cool for about 5 minutes,0,0,1,0,1118
Construct a Raised Planting Bed - Constructing the Frame,Attach the boards to the stakes with nails or screws,1,2,1,1,1119
Accessorize Your Kitchen - Giving Your Kitchen a Theme and Colour Scheme,Make sure your theme and colour scheme are compatible,1,1,1,1,1120
Play French Darts,Set up the game,1,1,1,1,1121
Clean a Granite Sink - Removing Hard Water Stains,Dampen and put soap on the scrubber,1,1,0,1,1122
Text a Heart Using Symbols,Create a new message,1,1,1,1,1123
Toast Sunflower Seeds - Microwave Toasting,Continue cooking the seeds in 1 minute intervals,1,1,1,1,1125
Use Microsoft Paint in Windows - Adding Text,Select a text color,0,0,1,0,1126
Report a Fake Account on Facebook - Using the Mobile App,Tap This is a fake account,1,1,0,1,1130
Report a Fake Account on Facebook - Using the Mobile App,Tap ⋯ (iPhone/iPad) or ⁝ (Android),1,1,1,1,1131
Update Your Vehicle Registration - Changing Your Name,Complete a vehicle registration application,1,1,1,1,1133
Change Your General Preferences on Safari - iOS,Tap the Settings app on your device,1,1,0,1,1137
Dry Sage - Drying Sage in a Food Dehydrator,Dry the sage alone so that the flavors will not get mixed,1,1,1,1,1138
Sharpen a Swiss Army Knife - Finishing Up,Strop the blade,1,1,1,1,1139
Report International Fraud - Reporting International Scams to EConsumer, Describe your complaint,1,1,1,1,1140
Report Visa Violations - Reporting a Visa Holder,Submit your tip to ICE,0,0,0,0,1142
Apply for a Utility Patent - Evaluating Your Invention's Patentability,Conduct a prior art search,1,2,1,1,1143
Uninstall Twitch on PC or Mac - Using Mac,Drag and drop the Twitch icon to the Trash bin on the Dock,0,1,0,0,1144
Build a Go Kart - Mounting the Engine and Steering Column,Install the engine mount,1,2,1,1,1146
Learn Hypnosis - Mastering a Hypnotic Routine,Reach the person’s unconscious mind with a story,0,0,0,0,1147
Turn On Windows Defender - Turning on Windows Defender,Open Settings,1,1,1,1,1148
Change Your General Preferences on Safari - iOS," Scroll down and tap ""Safari",1,1,1,1,1149
Palpate Axillary Lymph Nodes - Performing the Exam,Relax into a comfortable position,1,1,1,1,1151
Stop Hormone Replacement Therapy (HRT) - Stopping Hormones,Use hormones less often if directed to do so by your doctor,1,2,1,1,1152
Set Google Chrome As Your Default Browser - macOS," Click the ""Default web browser"" menu and select Google Chrome",1,1,1,1,1153
Send a Message on Omegle on iPhone or iPad,Press the blue arrow to send your message,1,1,1,1,1154
Collect Sperm for Analysis - Ensuring an Accurate Analysis,Avoid interfering with the contents of the container afterwards,1,2,1,1,1155
Do a Pour Painting - Finishing Your Painting,Let the painting dry for 2-3 days,1,1,1,1,1157
Write Headings for an Article - Writing Headings for APA Articles,Write a level three heading,0,0,0,0,1158
Improve Sperm Morphology - Using Nutrition," Vitamin C has been shown to promote the overall quality of sperm, including sperm morphology, so make sure that you eat plenty of vitamin C-rich foods every day",1,1,1,1,1159
Get an Article Approved in wikiHow's Quality Review,Make sure the topic isn't one we already have,1,1,1,1,1160
Make Rock Cakes - Variations,Add chopped apples and cinnamon for apple cakes,0,0,0,0,1161
Gently Curl Your Hair - Using a Headband,Split your hair into two equal-sized sections,0,0,0,0,1162
Fix a Bicep Tear - Resuming Physical Activity,Do flexion stretches by bending your elbow 10 times,1,1,0,1,1165
Blow Dry Curly Hair with a Diffuser - Blowing It Dry,Move on to the next section of hair,1,1,1,1,1166
Turn On Windows Defender - Turning on Windows Defender,Click  Update & Security,1,1,1,1,1167
Promote Root Growth - Encouraging Growth in Cuttings,Check daily for growth,0,0,0,0,1168
Turn On Windows Defender - Turning on Windows Defender,Click the Windows Security tab,1,1,1,1,1170
Take Legal Action for Player to Player Violence - Negotiating a Settlement with the Player,Sign a settlement agreement if you reach a resolution,1,1,1,1,1172
Make Your Mobile Phone Number Appear As a Private Number - Asking Your Carrier To Make Your Number Private,try to make a call to a person that is near you to be sure that the carrier has take care of the request.,0,0,0,0,1174
Flat Iron Hair - Learning the Technique,Move the straightened piece out of the way and unclip a new section of hair,1,1,1,1,1176
Make Non Alcoholic Blue Curacao - Making the Orange Base,Combine the juice and peels,1,0,1,1,1177
Catalogue Your Books with Goodreads - Adding Shelves to Your Virtual Bookshelf,Name the shelf,1,1,1,1,1178
Simulate a Fair Coin Toss With a Biased Coin - Steps,Designate one outcome heads,0,1,1,1,1179
Clean Brass Handles - Cleaning Brass Plate,Utilize soapy water to clean lacquered brass-plated handles,1,1,0,1,1180
Use Excel - Creating Charts,Edit your chart's title,0,1,0,0,1183
Report a Fake Account on Facebook - Using the Mobile App,Tap Submit to Facebook for review,1,1,1,1,1184
Read Google Books,Click Read for free or Preview,0,1,0,0,1185
Start a Yeast Free Diet - Trying a Four to Six Week Diet,Familiarize yourself with the foods that you can eat,1,1,1,1,1187
Make Shrimp Chef Salad with Lime and Cilantro,Soften the ramen noodles and add them to the salad,1,1,1,1,1188
Clean Brass Handles - Cleaning Brass Plate,Use ammonia or mild soap on unlacquered brass-plated handles,1,1,0,1,1190
Diagnose a Fistula - Getting a Medical Diagnosis,Consent to imaging tests,0,1,0,0,1191
Know when to Use Oil Based Paint Instead of Latex,Determine the application,0,1,1,1,1192
Glue Fabric to a Hat Frame,Apply another coat of glue to the hat frame,1,1,1,1,1193
Clear Your Browser's Cache - Firefox on Desktop,Click Clear Recent History…,0,1,1,1,1195
Make a Temporary Tattoo Last Longer - Preparing Your Skin,"Once the tattoo is applied, spray it with hair spray.",0,0,0,0,1196
Transfer Nokia Contacts to a Samsung - Syncing Google Contacts,Tap Add account,0,1,0,0,1197
Find Fulfilling Work - Finding a Possible Career Path,choose best one as our convenient,0,-1,0,0,1198
Make Rainbow Frosting - Skittles Rainbow Frosting,Spoon the frosting colors onto a piping bag,0,0,0,0,1199
Row on a Rowing Machine - Completing the Movement,Practice  Angle arms,0,0,0,0,1200
Be Ready and Comfortable Kissing a Guy,hold your boy friend's hand tightly,0,0,0,0,1202
Gently Curl Your Hair - Using a Headband,Twist the left section onto a tight rope just behind your ear,0,0,0,0,1203
Make a Balloon Pet - Balloon stress relief pet,Stretch the open end of the balloon a bit,1,1,1,1,1204
Decorate Garden Stones - Organizing Your Project,use cheap brushes,0,0,0,0,1205
Make Vegetarian Yakisoba, Heat oil,1,1,1,1,1206
Get Rid of Spiders in the House - Verified Pest Control Methods,Apply a residual insecticide,1,1,0,1,1207
Collect Sperm for Analysis - Ensuring an Accurate Analysis,Place the lid on the container and put it in the plastic bag provided,1,2,1,1,1208
Measure Helmet Size - Trying on a Helmet,Shake head side to side to note helmet movement,1,2,1,1,1209
Construct a Raised Planting Bed - Constructing the Frame,Mark the outlines of the planter where you want to build,0,1,0,0,1210
Learn Cooking by Yourself - Mastering the Basics,Start from making simple meals ,1,1,1,1,1211
Blow Dry Curly Hair with a Diffuser - Blowing It Dry,Flip your hair upside down,1,1,1,1,1214
Apply for a Job in Canada - Applying and Interviewing,Follow up with the company in 2-3 days,1,1,1,1,1215
Report International Fraud - Reporting International Scams to EConsumer,Complete a complaint,1,1,1,1,1216
Keep a Pet Snail - Making a Habitat,Cover the bottom of the container with 1-2 inches of the substrate of your choice,1,1,0,1,1217
Polish Chrome Wheels - Cleaning Your Wheels,Fill a bucket with warm water and car soap,0,0,0,0,1218
Create a Fillable PDF - Editing Form Fields,Edit an existing text field,1,1,1,1,1219
Make Vegetable Fritters - Making Gluten Free Vegetable Fritters,Heat some oil in a skillet,0,1,1,1,1220
Be Ready and Comfortable Kissing a Guy,make the kiss natural,0,1,1,1,1221
Cut Zucchini - Dicing,Turn the zucchini and cut crosswise to make cubes,0,1,0,0,1222
Make a Vanilla Cake - Basic Vanilla Cake,Bake the cake,1,1,1,1,1226
Separate Sand and Salt - Carrying Out the Experiment,Remove mixture from heat,0,1,1,1,1227
Build a DIY Picture Frame Shelf - Making a Gallery Ledge Shelf,Hang your shelf and display your pictures,0,0,0,0,1228
Turn Off Voicemail on a Samsung - Changing Call-Forwarding Settings,Tap Forward when busy,0,1,0,0,1229
Buy Postage Online - Purchasing Postage Labels Online with Stamps.com,"Read the ""About"" section on the website.",0,0,0,0,1230
Uninstall Twitch on PC or Mac - Using Mac,Select Delete Immediately on the right-click menu,0,1,0,0,1231
"Add Colorful Emoticons, Icons and Smiley Faces in Outlook"," Click on the ""OK"" button and now you can use the pictures or images in your email by just typing that particular character which you have defined for them",1,1,1,1,1232
Report Visa Violations - Reporting a Visa Holder,Call the number of the hotline or local ICE office,1,0,1,1,1233
Replace Scooter Wheels - Removing the Old Wheels,Flip your scooter over so the wheels face upwards,1,0,1,1,1235
Separate Sand and Salt - Carrying Out the Experiment,Heat the mixture,1,1,1,1,1236
Get a Federal Explosives License - Submitting a Complete Application,Pay the fee,1,1,1,1,1237
Harvest Purslane - Growing Purslane,Manage purslane size with frequent harvesting,0,1,1,1,1239
Apply Serum to Your Hair - Using the Right Amount of Serum,Rub the serum in your palms well,0,1,1,1,1242
Keep a Pet Snail - Making a Habitat,Get a plastic tank or container for your snail,1,1,1,1,1243
Find a Nursing Home for a Senior - Getting Set up in the Nursing Home,Help the nursing home staff decide on a care plan,1,1,1,1,1244
Make a Vegan Avocado Chocolate Cake,Ice when cooled,1,1,0,1,1245
Paint Patio Furniture - Refinishing Rusty Metal Furniture,Spread a nonslip drop cloth on the ground where you’ll be working,0,1,0,0,1246
Store Avocado - Packaging a Cut Avocado,Brush any exposed surfaces of the fruit with lemon juice,1,0,1,1,1249
Make Non Alcoholic Blue Curacao - Making the Orange Base,Wash the oranges,1,1,1,1,1250
File for a K1 Visa - Filing Your Petition with USCIS,Download the petition and instructions,1,1,1,1,1252
Grow Birch Trees - Planting the Birch Tree,Place the seedling in the hole and replace the soil,1,1,1,1,1253
Clean Behind Your Ears - Cleaning With a Cotton Swab,Prepare the cotton swab with your cleanser,1,1,1,1,1254
Grow Birch Trees - Planting the Birch Tree," Dig a shallow, wide hole in the ground",1,1,1,1,1255
Make Caramel Frosting - Making Classic Caramel Frosting,first decide how to make,1,1,1,1,1257
Gently Curl Your Hair - Using a Headband,Start with slightly damp hair,0,1,1,1,1258
Clear Your Browser's Cache - Firefox on Desktop," Check the ""Cache"" box",0,1,1,1,1259
Clean Under Laptop Keyboard Keys - Putty,Place putty on the keyboard,1,1,1,1,1260
Support the ACLU - Taking Action Online,before that choose relevant action,0,1,0,0,1261
Password Protect a PDF - Using PDF2Go,Disable PDF permissions,1,-1,0,0,1262
Make an Outdoor Canopy - Making a Canopy with 4 Poles and a Tarp,"Buy a high-quality tarp with grommets, big enough to cover the desired area",1,1,1,1,1264
Make Non Alcoholic Blue Curacao - Making the Orange Base,Steep the orange peels,0,1,0,0,1265
Know when to Use Oil Based Paint Instead of Latex,Know the trait of the paint,1,1,1,1,1266
Play With Your Hermit Crab - Handling Your Hermit Crab,Supervise your hermit crab while it roams and explores,1,0,0,0,1267
Make Chocolate Babka - Making the Filling,"You will need a pan, oven, and heatproof bowl in order to make the filling.",1,1,1,1,1269
Wind a Grandfather Clock - Winding a Chain-Wound Clock,Look for chains hanging next to the weights,1,1,1,1,1271
Make a Candy Wrapper Collage - Fabric collage,Cut and arrange the fabric materials following your design,0,1,0,0,1272
"Make a Plaster Cast of a Footwear Mark, Tyre Impression or Animal Footprint",Store and transport the cast,0,1,1,1,1273
Use Microsoft Paint in Windows - Adding Text,Change the font's size,0,0,0,0,1274
Repair a Book's Binding - Reattaching Loose Pages,Set the pages back on the spine,1,1,1,1,1277
Use Microsoft Paint in Windows - Adding Text,Add formatting to the text,0,1,1,1,1278
Make a Pumpkin Cake - Vegan Pumpkin Cake,Bake the cake,1,1,1,1,1279
Dry Sage - Drying Sage in a Food Dehydrator,Pre-heat dehydrator with the thermostat set to 95°F to 115°F,1,1,1,1,1280
Kill English Ivy - Killing Ivy on Trees,Monitor the area for new ivy growth,0,1,1,1,1281
Cook Freekeh - Freekeh Pilaf,Simmer for 15 minutes,1,1,1,1,1282
Make Crunchy Cajun Potato Snacks,Add more Cajun,1,1,1,1,1285
Write a Hypothesis for an Essay - Composing the Hypothesis,Be as specific as possible,1,1,1,1,1286
Cook Green Beans - Cooking Green Beans in Other Ways,Sauté green beans for 1 to 2 minutes after steaming them,1,1,0,1,1287
Get an Article Approved in wikiHow's Quality Review,"Make sure clear, relevant images accompany your article.",1,1,1,1,1288
Find Surface Area of a Triangular Prism - Finding the Lateral Area,Multiply the perimeter of one base with the height of the prism,0,0,0,0,1289
Train Puggles - House-Training Your Puggle,Put your puggle on a training schedule,1,1,1,1,1290
Kill English Ivy - Killing Ivy on Trees,Get your equipment ready,1,1,1,1,1291
Open XML - Using a Text Editor,""" Select ""Notepad"" (Windows) or ""TextEdit"" (Mac)",1,1,1,1,1292
Diagnose a Fistula - Getting a Medical Diagnosis,Let your doctor perform a physical,1,1,1,1,1293
Calculate Bond Discount Rate - Calculating the Present Value of the Bond's Principal,Calculate the current market interest rate for each payment period,1,1,1,1,1294
Change the Root Password in Linux - With the Current Root Password,Retype the new password and press ↵ Enter,0,1,1,1,1295
Cite a Syllabus in APA - Integrating an In-Text Citation,End the citation with the page number or numbers,1,1,1,1,1296
Clean Behind Your Ears - Cleaning With a Cotton Swab,Wipe dirt away gently,1,1,1,1,1297
Grow Taro - Growing Shoots on Tubers," Choose healthy-looking, large tubers for planting",1,1,1,1,1298
Make Pickles - Simple Pickles,Refrigerate overnight,1,1,1,1,1299
Make Your Mobile Phone Number Appear As a Private Number - Asking Your Carrier To Make Your Number Private,Dial 611 and press the call button,0,0,0,0,1300
Play French Darts,Pick teams,0,0,0,0,1301
Blow Dry Layered Hair - Blow Drying Short Layers,"If your hair is several inches above your shoulders (your shortest pieces less than an inch long), section off the hair right above your ears and clip it away",0,0,0,0,1303
Stretch the Calf Area of Boots - Stretching Boots with Boot Bands,Pull the zipper up to connect the boot band to your boot,1,0,0,0,1304
Cure Astigmatism - Getting Laser Eye Surgery,Recover after the surgery,1,1,1,1,1305
Make Spring Rolls - Cooking Thai Fresh Rolled,Bring it to the cutting board,1,1,1,1,1306
Make a Paper Hat - Making a Sailor or Alpine Hat,Fold the paper in half widthwise,0,0,0,0,1307
Stop Hormone Replacement Therapy (HRT) - Stopping Hormones,Continue to be monitored by your doctor,1,1,1,1,1308
Make Vegetable Fritters - Making Gluten Free Vegetable Fritters,Salt and strain the zucchinis,0,0,0,0,1309
Alleviate Headaches During Pregnancy - Recognizing More Serious Problems,Use a blood pressure monitor to track your blood pressure throughout the day.,1,1,1,1,1310
Update Your Browser - Updating Apple Safari on Mac OS X,Click on the Apple menu and select “System Preferences,1,1,1,1,1314
Collect Rainwater for Drinking - Filtering the Rainwater,Run the water through an activated carbon filter to remove particulate,1,0,1,1,1316
Get Notified of Changes to a Dropbox on Android,Check the box next to each desired notification type,1,1,1,1,1317
Buy Postage Online - Purchasing Postage Labels Online with Stamps.com,Choose a delivery address,1,1,1,1,1319
Make a Vanilla Cake - Basic Vanilla Cake,Let the cake cool,1,1,1,1,1320
Recognize and Treat Postpartum Psychosis - Diagnosing Postpartum Psychosis,Provide as much information as possible,1,1,1,1,1321
Unhook a Bra - Unhooking Someone Else’s Bra,Push both sides in towards one another to relieve the tension on the connectors,1,1,1,1,1322
Hang Floating Shelves - Installing Cleats,Cut a 2x2 piece of wood long enough to fit inside your floating shelves,1,1,1,1,1323
Start a Yeast Free Diet - Trying a Four to Six Week Diet,Familiarize yourself with treats,1,0,1,1,1325
Diagnose a Fistula - Getting a Medical Diagnosis,Submit to any other recommended tests,0,0,0,0,1326
Become a Registered Nurse - Obtaining the Correct Education and Credentials,Undertake post-secondary education in nursing,1,1,1,1,1327
Test Liver Function - Getting the Blood Test,Put pressure on the injection site and let it heal,1,1,1,1,1328
Make Soursop Juice - Mashing the Soursop,Place the soursop into a bowl and add the milk or water,0,0,0,0,1329
Teach Yourself to Get Up As Soon As Your Alarm Clock Goes Off - Waking Up,Use your environment to help you continue to wake up,1,0,0,0,1330
Make a Tight Turn Quickly in a Car - Using Your Handbrake,Turn your wheel into the turn,1,1,1,1,1331
Hide Friends on Facebook - On Mobile,Tap Privacy,1,1,1,1,1332
Dispose of Coffee Grounds - Making a Compost Heap,Start with a layer of course branches and twigs to promote air flow,1,1,1,1,1333
Hide Friends on Facebook - On Mobile,Scroll down and tap Settings,1,1,1,1,1334
Ride the Disneyland Monorail - Preparing to Board,Watch the monorail doors as they close,0,1,0,0,1337
Remove Wrinkles from Leather Jackets - Steaming the Jacket,Hang the coat and shower,0,0,0,0,1339
Blow Dry Curly Hair - Blowing It Dry,Continue until your hair is mostly dry,1,1,1,1,1340
Cure Astigmatism - Getting Laser Eye Surgery,you can only partially focus on an object,1,1,1,1,1341
Cut Zucchini - Dicing,Cut off the stem and blossom ends,1,1,1,1,1342
Uninstall Twitch on PC or Mac - Using Mac,Click the Trash bin icon on the Dock,0,0,0,0,1343
Clear Your Browser's Cache - Firefox on Desktop,Click Clear Now,1,1,1,1,1345
Tell If Someone Is in Your Closet," Ask ""Is anyone inside of my closet?"" Slowly open the closet door, having a good grip on the handle and using your foot to prevent the door from opening far",0,0,0,0,1346
Use Google Keyword Planner - Multiplying Keyword Lists to Get New Keyword Ideas,Click on multiply keyword lists to get new keyword ideas,1,1,1,1,1347
Defrost Salmon - Thawing in Cold Water, Set the bagged salmon into a bowl,1,1,1,1,1348
Identify Songs Using Melody - Using Technology,Post up your query,1,1,1,1,1349
Use Massage for Neck Pain - Giving Yourself a Massage,Massage pressure points,1,1,1,1,1351
Download Kindle Books on an iPad - Adding Non-Kindle Content to Your Kindle App,Send compatible documents to your Kindle app,1,1,1,1,1352
Glue Fabric to a Hat Frame,Press and smooth one small area at a time,1,1,1,1,1353
Toast Sunflower Seeds - Stovetop Toasting,Turn the heat down to low once the seeds start browning,1,1,1,1,1356
Accessorize Your Kitchen - Giving Your Kitchen a Theme and Colour Scheme,Look at the Big Picture.,0,0,0,0,1358
Use a Litter Box for a Rabbit - Setting up the Litterbox,Cover the litter with hay up to the top of the litterbox,0,0,0,0,1359
Reset Browser Settings - Firefox,Click on Troubleshooting Information,0,0,0,0,1360
Delete Bookmarks - Firefox," Right-click on a bookmark and select ""Delete"" to remove it",1,1,1,1,1361
Go to Sleep Fast for Kids - Starting a Bedtime Routine,Take a warm bath,1,0,0,0,1363
Clean Your Dog's Toothbrush - Disinfecting the Toothbrush,Pour  water into a glass,1,1,1,1,1364
Create a Fillable PDF - Editing Form Fields,Click the location where you'd like to add a text field,1,1,1,1,1365
Make Non Alcoholic Blue Curacao - Making the Orange Base,stir the juice,1,1,1,1,1366
Buy a Remote Starter for a Truck,Read over the brochures and decide which systems have all of the features you need and want,1,1,1,1,1367
Give Flat Hair Volume - Drying Your Hair to Add Volume,Blow dry the underside of your hair,1,1,1,1,1369
Take Care of and Prevent a Rip in Gymnastics - Healing a Minor Gymnastics Rip,Know what a rip looks like,1,1,1,1,1371
Make Crunchy Cajun Potato Snacks,Prepare the potatoes,1,1,1,1,1373
Blow Dry Curly Hair with a Diffuser - Blowing It Dry,Lift the diffuser until it touches your head to dry your roots,1,1,0,1,1376
Use a GoPhone Plan With an iPhone - iPhone through iPhone 3GS,Make a call,0,0,0,0,1377
Dry a Dog - Drying Your Dog With a Chamois,Wring out the chamois,1,1,1,1,1378
Make Paper Dolls - Completing Your Paper Doll,Draw a base for your doll,1,1,1,1,1379
Calculate the Volume of a Prism - Calculating the Volume of a Triangular Prism,State your answer in cubic units,1,1,1,1,1380
"Add Colorful Emoticons, Icons and Smiley Faces in Outlook"," After Insertion of a particular image, select it to use in further procedure",1,1,1,1,1381
Clean Behind Your Ears - Cleaning With a Cotton Swab,Only use cotton swabs on the outside of the ear,1,0,0,0,1383
Preserve Lemons - Prepping the Lemons,Scrub the lemons' skins,1,1,1,1,1386
Get Married in Oregon - Planning a Wedding Ceremony,Make final payments,1,1,1,1,1387
Bake a Cake - Making Apple Cake,Stir the dry ingredients in a bowl,1,1,1,1,1389
Use Google Keyword Planner - Multiplying Keyword Lists to Get New Keyword Ideas," Click on ""get search volume",1,1,1,1,1390
Play With Your Hermit Crab - Handling Your Hermit Crab,Take pictures of the hermit crab,0,0,0,0,1391
Build a Home Studio for Computer Based Music Recording - Building a Home Studio,Learn how to record a sound from an input line and how to arrange pre-recorded sounds,1,1,1,1,1392
Peel a Pumpkin - Peeling with a Vegetable Peeler,Set up the pumpkin and the peeler,1,1,1,1,1393
Create a Kahoot Game,Go to https://create,0,0,0,0,1394
Separate Sand and Salt - Carrying Out the Experiment,Add water to the sand and salt,1,1,1,1,1395
Peel a Kiwi - Peeling kiwifruit with a spoon," Apply a small amount of pressure against the skin and gently turn the kiwifruit with your other hand, scooping the flesh away from the skin",1,0,0,0,1396
Hide Your Profile Picture on Facebook - Using a Computer,Click the tiny globe icon below your name on the top-right,1,1,1,1,1397
Pick out Your Perfect Cell Phone,Now you should have 2-3 phones,0,0,0,0,1400
Keep Japanese Weather Loaches - Setting up Your Aquarium," Decorate the tank with plants, rocks, and shelters",0,0,0,0,1401
Hide Toolbars - Hiding Toolbars in Google Chrome,Remove the check mark next to “Enabled” for each toolbar you want hidden,1,1,1,1,1402
Create MP3 Files from Wikipedia Articles Using Pediaphon - Setting Up the Article to Covert,Go to the Pediaphon website,1,1,1,1,1403
Calculate Bond Discount Rate - Calculating the Present Value of the Bond's Principal,Gather the information,1,1,1,1,1404
Play iPad Videos on TV - Using an Adapter,Turn on your TV,1,1,1,1,1405
Turn On Windows Defender - Turning on Windows Defender,Click Virus & threat protection settings,0,1,0,0,1407
"Add Colorful Emoticons, Icons and Smiley Faces in Outlook"," To confirm about adding of that particular image or logo, see the list given below under ""With"" option",1,1,1,1,1408
Cut Zucchini - Dicing,Carefully cut the zucchini into 3-4 vertical strips,0,0,0,0,1409
Fix a Bicep Tear - Resuming Physical Activity,Do 2 sets of 8 to 12 biceps curls,0,0,0,0,1410
File for a K1 Visa - Filing Your Petition with USCIS,Complete your petition,1,1,1,1,1412
Promote Root Growth - Encouraging Growth in Cuttings,Wrap a plastic bag around the cutting in the pot to prevent it from drying out,1,1,1,1,1413
Get a Federal Explosives License - Submitting a Complete Application,Mail the application,1,1,1,1,1415
Hang Floating Shelves - Installing Cleats,Decide where to install the cleat by locating the studs,1,1,1,1,1416
Apply for a Job in Canada - Applying and Interviewing,Write a cover letter for the specific job you’re applying for,1,1,1,1,1417
Arrange Silk Flowers - Creating Your Floral Arrangement,Fill in gaps with greenery,0,0,0,0,1418
Clean Behind Your Ears - Cleaning With a Cotton Swab,Wash ears with soap and water before using cotton swabs.,1,1,1,1,1421
