process,step,Hongming,Haoyu,Yuqian,ground_true_relabel,id
Cut Wood Slices - Cutting Large Slices with a Chainsaw,"Wear thick gloves, long sleeves, and protective goggles",1,1,1,1,734
Hang Floating Shelves - Installing Cleats,Secure the shelf to the cleat with nails or screws,1,1,1,1,735
Answer What Interests You About This Job - Showing Why You Like the Company,Do your research,1,1,1,1,736
Create a Macaron Cake - Assembling the Cake,Place the cooled cake disk onto a serving plate,0,1,0,0,737
Copy Text from a PDF to a Word Doc - Using Adobe Acrobat Reader for Windows or macOS,Open a new document in Word,1,1,1,1,739
Clean a Dog's Wound - Seeking Professional Veterinary Help,Take the dog to the vet for stitches if the wound is more than superficial,0,1,1,1,740
Cook Diced Beef - Sautéing Diced Beef,Remove the fat from your meat,1,1,1,1,741
Hide Your Profile Picture on Facebook - Using a Computer,Select Only me on the drop-down menu,1,1,1,1,742
Use Microsoft Paint in Windows - Adding Text,Select a location for your text,0,0,1,0,743
Dry Sage - Drying Sage in a Food Dehydrator,Check the leaves every 30 minutes to see if they're dry,0,1,0,0,744
Use Fashion Tape - Attaching the Tape,Press the tape onto the opposite surface,1,1,1,1,745
Watch TV Without Cable - Cancelling Cable Contracts,Try streaming for at least 3 months before returning to cable,1,1,0,1,746
Update Your Browser - Updating Apple Safari on Mac OS X,Type in the administrator password for your Mac computer at the prompt,0,0,0,0,748
Pasteurize - Using Direct Heat to Pasteurize,Place the containers into a large stockpot and then fill it with water,1,1,1,1,749
Make Aspirin if You're Lost in the Woods - Gathering Ingredients,Look for a white willow tree first,1,1,1,1,750
Cite a Website with No Author - MLA," Include the date the website was created, if available",1,1,1,1,751
Delete a YouTube Account - Deleting Accounts,Visit the Google Account Management page,1,1,1,1,754
Identify Songs Using Melody - Using Technology,Wait for an answer,1,1,1,1,755
Peel and Devein Shrimp - Deveining Shrimp,Keep the shrimp cold until you're ready to cook them,1,0,1,1,756
Become a Registered Nurse - Obtaining the Correct Education and Credentials,Get licensed,1,1,1,1,757
Rotate Pages in a PDF Document Using Adobe Acrobat - Steps,Set direction of rotation,1,1,0,1,758
Play Chopsticks on a Keyboard or Piano - Playing the Song,Practice and practice!,1,1,1,1,759
Open XML - Using a Text Editor,Find the XML file you want to open,1,1,1,1,760
Kill Ants in Your House - Eliminating a House Ant Colony,Take simple measures to prevent future ant invasions of your home,1,1,0,1,762
Use Instacart on an iPhone or iPad,Learn about the product pages,0,1,1,1,763
Get a Japanese Passport - Getting Your Passport,Wait 7 to 10 days for your passport,1,1,1,1,764
Make Slow Cooker Glazed Carrots - Whipping Up Slow Cooker Brown Sugar Glazed Carrots,Cook the mixture on high for 4 to 5 hours,1,1,1,1,765
Clean a CPAP - Cleaning Your CPAP Mask Daily,Consider using CPAP mask wipes,1,1,0,1,767
Read Google Books," Search for a book or magazine's title, author, ISBN, or keywords",1,0,1,1,768
Cover Dining Room Chairs - Covering Chairs with Store-Bought Slipcovers,Decide which type of fabric you want,1,1,1,1,770
Paint Bamboo Furniture - Painting the Furniture,make sure you clean the furniture first,1,1,1,1,771
Bake Eggs - Making Shirred Eggs,Bake the eggs for 7 to 12 minutes,1,1,1,1,772
Make Mod Podge - Making Glue-Based Mod Podge,Close the lid tightly and shake it,1,1,1,1,773
Flat Iron Hair - Learning the Technique,Run the flat iron down the length of your section of hair,1,0,1,1,774
Make Shrimp Chef Salad with Lime and Cilantro," Dice the cucumber and tomatoes, and then add them to the salad",1,1,1,1,777
Make a Vanilla Cake - Basic Vanilla Cake," Add the butter, one teaspoon at a time",1,1,0,1,778
Make Shrimp Chef Salad with Lime and Cilantro,Chop the lettuce and add it to a salad bowl,1,1,1,1,779
Apply for a Marriage License in Kentucky - Getting a Marriage License in Kentucky if Both Parties are over 18,Visit the county clerk’s office to apply for a marriage license,0,1,1,1,780
Use Google Keyword Planner - Using the New Keyword Search," Click on ""Get Ideas",1,0,0,0,781
Uninstall Twitch on PC or Mac - Using Mac,Open your Applications folder,0,0,0,0,783
Be Ready and Comfortable Kissing a Guy,use mouthwash,0,0,0,0,787
Peel and Devein Shrimp - Deveining Shrimp,Use a paring knife to make a slit along the shrimp's back,1,1,1,1,789
Make Pickles - Simple Pickles,Serve,0,0,0,0,791
Make a Vegan Avocado Chocolate Cake,Remove from the oven,1,1,1,1,794
Cook Hot Dogs - Frying Hot Dogs,Heat some oil in a frying pan,1,1,0,1,797
Build a Home Studio for Computer Based Music Recording - Building a Home Studio,Connect everything up,1,1,1,1,798
Build a Home Studio for Computer Based Music Recording - Building a Home Studio,Acquire the appropriate equipment,1,1,1,1,799
Report Visa Violations - Reporting a Visa Holder,Find a hotline or local office of ICE,1,1,1,1,800
Grow a Magnolia Tree - Laying the Seed,Collect some seed pods,1,1,1,1,801
Download Google Docs - On Desktop,Select a document,1,1,1,1,805
Control Notifications on Periscope - Configuring Periscope’s Notifications Settings on iOS,"Select how you would like your notifications to be displayed (e.g., banner).",1,1,1,1,806
Build a Home Studio for Computer Based Music Recording - Building a Home Studio,Write a plan of what you want to do,1,1,0,1,810
Cover Dining Room Chairs - Covering Chairs with Store-Bought Slipcovers,Count the number of chairs you need to cover,1,0,1,1,811
Change Your General Preferences on Safari - iOS," Enable ""Do Not Track"" to help prevent websites from tracking your browsing",0,0,0,0,813
Dispose of Coffee Grounds - Making a Compost Heap,Brew some coffee.,1,1,1,1,816
Kill English Ivy - Killing Ivy on Trees,Cut the vines around the base of the tree,0,1,1,1,817
Delete a YouTube Account - Deleting Accounts," Click the ""Delete Google+ profile and features"" link",1,1,1,1,819
Switch Medicare from One State to Another - Moving with a Medigap Plan,Notify your insurance company of your address change,1,1,1,1,820
Make a Camo Cake - Baking the Cake,Preheat the oven according to the temperature on the boxed mix,1,1,1,1,825
Use Your Android As Your Workout Trainer - Using My Coach - Workout Trainer,Start a workout,1,1,1,1,826
Replace Scooter Wheels - Removing the Old Wheels,Loosen the screws of the old wheel with 2 allen wrenches,1,1,1,1,827
Paint a Model Car - Hand Painting the Car,Paint the smaller pieces of your model first,1,0,1,1,828
Have Assault Charges Dropped - Taking Preliminary Steps,Decide why you want to drop the charges,1,1,1,1,830
Cook Hot Dogs - Frying Hot Dogs,Place the hot dog pieces in the frying pan,1,1,1,1,831
Quickly Make an Alcoholic Party Punch - Classic Sangria,Mix the ingredients,1,1,1,1,833
Brown a Roast for Cooking in a Crockpot,Trim any excess fat off the meat,1,1,1,1,835
Grow Birch Trees - Planting the Birch Tree,Plant the seedling when it reaches 15 to 20 inches (40 to 50 cm) tall,1,1,1,1,836
Text a Heart Using Symbols,Add a 3,0,0,0,0,839
Write a Hypothesis for an Essay - Composing the Hypothesis,Determine what part of the experiment you will manipulate,1,1,1,1,840
Password Protect a PDF - Using PDF2Go,Enter a password,1,1,1,1,841
Write a Customer Relationship Management Plan - Writing Your CRM Plan,Construct a policy to handle customer communications,1,1,1,1,843
Cook Freekeh - Freekeh Pilaf," Add the stock, salt, and pepper",0,1,1,1,844
Field Dress a Deer - Removing the Entrails,Remove the sex organs if they’re in the way (when applicable),1,1,1,1,845
Block a Website with an Internet Filter - Block Website with Internet Filter,"Bring up Aobo Filter with HotKey ""ALT+SHIFT+F1"" Click the green ""+"" button to add any keyword to the ""Black List"", then choose the number of ""Amount of Keywords detected to trigger filtering""",1,0,0,0,847
Control Notifications on Periscope - Configuring Periscope’s Notifications Settings on iOS,Go to Notifications,1,1,1,1,849
Grow a Magnolia Tree - Laying the Seed,Store seeds,0,0,0,0,851
Change the Root Password in Linux - With the Current Root Password,Open a terminal window,1,1,1,1,855
Make Curly Fries - Baking the Fries,Heat the oven ,1,1,1,1,856
Pay Your Taxes - Submitting Payment through the Mail,Include any payment slip or voucher that you've received,1,1,1,1,859
Send a Message on Omegle on iPhone or iPad,Tap Chat,0,1,1,1,861
Find the Flashlight on an iPhone - Using Control Center,Hold the flashlight icon to open the option for adjusting the brightness.,1,1,0,1,862
Paint Bamboo Furniture - Painting the Furniture,Apply a thin coat of the paint to the bamboo furniture,1,1,1,1,863
Kill English Ivy - Killing Ivy on Trees,Wait for the ivy to die,0,0,0,0,864
Bake Halibut - Parchment Baked Halibut,Bake for 15 minutes,1,1,1,1,867
Play With Your Hermit Crab - Handling Your Hermit Crab,keep it or maintain it as normal cold,0,1,1,1,869
Pressure Wash Vinyl Siding - Spraying on the Cleaning Solution,Increase the pressure incrementally,1,1,1,1,870
Make an Outdoor Canopy - Making a Canopy with 4 Poles and a Tarp,Lift up the tarp with the help of 4 people and stick the poles into the ground,0,0,0,0,871
Cook Diced Beef - Sautéing Diced Beef,Check to see that your meat is properly cooked,1,1,1,1,872
Clean a MacBook Pro Keyboard - Cleaning and Disinfecting the Keyboard Surface,Dust the surface of your keyboard ,1,1,1,1,880
Brake Properly on a Motorcycle - Coming to a Controlled Stop,Ease off the throttle,1,1,1,1,882
Rotate Pages in a PDF Document Using Adobe Acrobat - Steps,The selected pages are rotated in the specified direction,1,1,1,1,884
Make Banana Walnut Cake Pops - Decorating the Cake Balls,Drizzle additional melted chocolate on top,1,1,1,1,887
Report a Fake Account on Facebook - Using the Mobile App,Wait for Facebook to review and coming back with a conclusion,1,1,1,1,888
Make a Pumpkin Cake - Vegan Pumpkin Cake,Have the cake cool,1,1,1,1,895
Boil Cabbage - Preparing the Cabbage,Rinse the entire head of cabbage,1,1,1,1,896
Connect Jambox to Mac - Turning On Bluetooth on your Mac,Click System Preferences,1,1,1,1,897
Sharpen a Swiss Army Knife - Finishing Up,Check the sharpness,1,1,1,1,898
Talk About Daily Stress with Your Partner - Having Daily Conversations,Approach your partner,1,0,1,1,899
Defrost Salmon - Thawing in Cold Water,Refresh the water every 10 to 20 minutes or use running water,1,1,0,1,900
Contact the iTunes Store - Using Apple Support Resources,Email iTunes if you don't mind waiting a few days,1,0,1,1,901
Identify Songs Using Melody - Using Technology,Use a music-recognition app,0,0,1,0,903
Gently Curl Your Hair - Using a Headband,Repeat the process on the other side of your head,0,1,0,0,904
Clean Skylights - Cleaning Skylights from the Outside,Use a mix of vinegar and water for stains like sap and hard residue,0,1,0,0,905
Download Google Docs - On Desktop,Open Google Docs,1,1,1,1,907
Repair Car Paint Chips - Repainting Medium Sized Chips,Use rubbing alcohol to remove grease and oil,0,1,0,0,909
Rotate Pages in a PDF Document Using Adobe Acrobat - Steps,Click OK,1,1,1,1,910
Accessorize Your Kitchen - Giving Your Kitchen a Theme and Colour Scheme,Create a colour scheme to give your kitchen a cohesive look,1,1,1,1,911
Use Your Android As Your Workout Trainer - Using My Coach - Workout Trainer,View the workouts,0,0,0,0,914
Change Your Password in Linux Using Terminal,Type password in the terminal,1,1,1,1,915
Get a Dog to Listen - Using a Dog’s Name to Get Its Attention,Offer a treat when you say the dog’s name,1,1,1,1,916
Stay Organized when Moving," Now, on the page of your notebook for that room (for example, your K section for kitchen), write the box number and detailed information about the contents",0,0,0,0,919
Become a Registered Nurse - Obtaining the Correct Education and Credentials,Continue courses as required,1,1,1,1,920
Keep Japanese Weather Loaches - Setting up Your Aquarium,Install a heater inside your tank to keep it warm,1,1,1,1,921
Peel a Kiwi - Peeling kiwifruit with a spoon,Cut off both ends of the kiwifruit using a serrated paring knife,1,1,0,1,925
Quickly Make an Alcoholic Party Punch - Classic Sangria,Gather Supplies,1,1,1,1,927
Clear Your Browser's Cache - Firefox on Desktop,Click History,1,1,1,1,928
Go to Sleep Fast for Kids - Starting a Bedtime Routine,Talk quietly or read a story,0,1,0,0,929
Get Amaryllis to Rebloom - Caring for Amaryllis in Summer,Continue to water regularly,1,1,1,1,930
Make a Paper Hat - Making a Sailor or Alpine Hat,Fold 1 of the flaps along the bottom edge up,0,0,0,0,932
Cook Freekeh - Freekeh Pilaf,Soak the freekeh in cold water,0,1,1,1,933
Answer What Interests You About This Job - Showing Why You Like the Company,Make notes,1,1,0,1,938
Make a Vanilla Cake - Basic Vanilla Cake,Add the sugar and eggs,1,1,1,1,939
Paint Patio Furniture - Refinishing Rusty Metal Furniture,Apply a rust converter solution to your furniture,0,1,0,0,940
Bake a Cake - Making Apple Cake,Prepare the apples,1,1,1,1,941
Text a Heart Using Symbols,Enter the recipient,1,1,1,1,942
Care for a Hedgehog with Wobbly Hedgehog Syndrome - Seeking Veterinary Care,Recognize the symptoms of Wobbly Hedgehog Syndrome,1,1,1,1,943
Grow Birch Trees - Planting the Birch Tree,Select a planting location with full sun,1,1,1,1,944
Convert from Decimal to Binary - Descending Powers of Two and Subtraction,Write out the binary answer,1,1,1,1,945
File a Complaint Against an Arizona Real Estate Agent - Complaining to the Arizona Department of Real Estate,Write a narrative statement of your complaint,1,1,1,1,946
Download Kindle Books on an iPad - Adding Non-Kindle Content to Your Kindle App,Open Kindle Cloud Reader and log in with your Amazon credentials.,1,1,1,1,947
Bake a Cake - Making Apple Cake," Grease and flour the cake pan, then preheat the oven to 350 °F (177 °C)",1,1,1,1,948
Make a Motion at a Board of Directors Meeting - Reaching a Resolution,Help draft the resolution,1,1,0,1,949
Dry a Dog - Drying Your Dog With a Chamois,Be gentle,0,0,0,0,951
Pay Your Taxes - Submitting Payment through the Mail,Get a bank check or money order,0,1,0,0,952
Make a Motion at a Board of Directors Meeting - Reaching a Resolution,Nod to show you are listening.,0,0,1,0,953
Hide a Lip Piercing from Parents or Bosses - Concealing Getting the Piercing,Choose a clear bioplast loop or stud for the piercing,0,0,0,0,956
Watch TV Without Cable - Cancelling Cable Contracts,Try a new cable provider if you go back,0,0,0,0,958
Make Caramel Frosting - Making Classic Caramel Frosting," Let the mixture boil, then pour and stir in the milk",1,1,1,1,959
Make Paper Dolls - Completing Your Paper Doll,Create a stand for your doll,1,1,1,1,960
Use Microsoft Publisher - Saving Your Document,” Type a name for your document in the “Save As” dialog box,0,0,0,0,961
Go to Sleep Fast for Kids - Starting a Bedtime Routine,Put on pajamas,0,0,0,0,962
Catalogue Your Books with Goodreads - Adding Shelves to Your Virtual Bookshelf,Visit Goodreads,0,1,1,1,963
Fix a Bicep Tear - Resuming Physical Activity,Perform shoulder shrugs and shoulder blade pinches,0,0,0,0,964
Send a Message on Omegle on iPhone or iPad,Tap the Omegle app icon to open it,1,1,1,1,965
Dispose of Coffee Grounds - Making a Compost Heap," Toss in coffee grounds, fruit and veggie scraps, and eggshells",0,1,1,1,966
Clear Your Browser's Cache - Firefox on Desktop,Click ☰,1,1,1,1,967
Clean Rust Off Cast Iron - Using Vinegar,Check the pan regularly as it soaks,1,1,1,1,968
Store Avocado - Packaging a Cut Avocado,Wrap the avocado in plastic wrap to seal it,1,1,0,1,969
Open XML - Using a Text Editor," Right-click the XML file and select ""Open With",1,1,0,1,971
Send a Message on Omegle on iPhone or iPad," Tap Man, Woman or Anyone",0,0,0,0,973
Get Notified of Changes to a Dropbox on Android,Open Dropbox on your Android,1,1,0,1,974
Get a Japanese Passport - Getting Your Passport,Gather the necessary documents,1,1,1,1,976
Rotate Pages in a PDF Document Using Adobe Acrobat - Steps,Open the Rotate Pages dialog box,1,1,1,1,977
Learn Cooking by Yourself - Mastering the Basics,Start with breakfast,0,0,0,0,978
Bake Halibut - Parchment Baked Halibut,Season with salt and pepper,1,1,1,1,980
Get Married in Oregon - Planning a Wedding Ceremony,Hire wedding vendors,0,0,0,0,981
Get Notified of Changes to a Dropbox on Android,Tap Settings,1,1,1,1,983
Change the Root Password in Linux - With the Current Root Password,Type passwd and press ↵ Enter,1,1,1,1,985
File a Complaint Against an Arizona Real Estate Agent - Complaining to the Arizona Department of Real Estate,Submit your complaint package,1,1,1,1,986
Get Your Site Indexed in Live Search,Click submit URL ,1,1,1,1,987
Play French Darts,Gather materials,1,1,1,1,989
Paint Patio Furniture - Refinishing Rusty Metal Furniture,Allow your furniture to dry for 45 minutes between coats,1,1,1,1,990
Make a Candy Wrapper Collage - Fabric collage,Collect the pieces of fabric you're going to use for making the collage,1,1,1,1,991
Boil Cabbage - Preparing the Cabbage,Shred or chop your cabbage into the desired shape,1,1,1,1,992
Make a Camo Cake - Baking the Cake,Prepare the boxed cake mix following the instructions on the back,1,1,1,1,993
Make Aleppo Soap - Molding the Soap,Remove the soap from the molds and cure for several weeks,1,1,1,1,994
Cook Goose Breasts - Pan-Roasted Goose Breasts,Take a fork and quickly stab all over the breast to tenderize.,1,1,1,1,995
Make an Automatic Chicken Feeder - Cutting Out Your Pieces,Make holes with a hole saw,1,1,1,1,996
Give a Thumbs Up for an Edit on wikiHow - Giving Someone a Thumbs Up in Recent Changes Patrol,Going back to double check.,0,0,0,0,999
Diagnose a Yeast Infection at Home - Using a Home Test Kit,INSERT THE SWAP INTO YOUR VAGINA AND PRESS IT AGAINST THE VAGINAL WALL,1,1,1,1,1000
Give a Thumbs Up for an Edit on wikiHow - Giving Someone a Thumbs Up in Recent Changes Patrol,Look at edits on wikiHow,1,1,1,1,1002
Hide Toolbars - Hiding Toolbars in Google Chrome,Click on the Chrome menu button located at the top right corner of your Chrome session,1,0,1,1,1003
Service an Air Conditioner - Clean the Air Conditioner,Rake any leaves and debris away from the unit before you start to service an air conditioner,1,1,1,1,1004
Apply for a Utility Patent - Evaluating Your Invention's Patentability,Determine your invention's classification,1,1,1,1,1005
Decorate Garden Stones - Organizing Your Project,Sketch your design,1,1,1,1,1006
Go to Sleep Fast for Kids - Starting a Bedtime Routine,Play some soothing music,0,0,0,0,1007
Feather Your Hair - Prepping Your Hair,Have your hair cut,0,1,0,0,1008
Watch TV Without Cable - Cancelling Cable Contracts,Get recommendations from others who have cut the cable cord,0,0,0,0,1012
Play iPad Videos on TV - Using an Adapter,Connect the adapter to your TV,1,1,1,1,1014
Use Excel - Creating Charts,Select a chart template,1,1,1,1,1015
Ride the Disneyland Monorail - Preparing to Board," Wait for the aluminum white safety gate to open, before crossing the platform and walking up to the train",1,1,1,1,1018
Be Ready and Comfortable Kissing a Guy,Look at his lips,0,0,0,0,1019
Stay Organized when Moving,"Get a spiral notebook, a roll of masking tape, a pen, a Sharpie, and some sheets of labels",1,1,1,1,1020
Sell Crafts Online Easily - Launch Your Website,Name your business. Price the products,1,1,1,1,1022
Make a Vegan Avocado Chocolate Cake,Add the ground hazelnuts,1,1,1,1,1023
Make Soursop Juice - Mashing the Soursop,Squeeze the fruit with your hands,0,0,0,0,1025
Simulate a Fair Coin Toss With a Biased Coin - Steps,Find any coin,1,1,0,1,1026
Hide Toolbars - Hiding Toolbars in Google Chrome,A list of all your Google Chrome extensions will open in a new tab,0,0,0,0,1027
Calculate the Volume of a Cube - Finding Volume from Surface Area,Take the square root of this value,1,1,1,1,1028
Make Clove Oil - Gathering Your Ingredients and Supplies,Get a bottle of olive oil,1,1,1,1,1029
Use Instacart on an iPhone or iPad," Use the ""Your Items"" tab to personalize your browsing",0,0,0,0,1030
Cook Green Beans - Cooking Green Beans in Other Ways," Cook green beans in a crock pot for a warm, hearty meal",1,1,1,1,1031
Make a Gas Mask - Making an Air Filter for your Mask,Fill the bottom of the bottle ,1,1,1,1,1032
Make Tumblr Edits - Editing Posts Using URLs,"Log into Tumblr, then navigate to the URL of the post you want edited",1,1,1,1,1035
Be a Good Hamster Owner (for Kids) - Cleaning Your Hamster’s Cage,Wash the habitat,1,1,1,1,1036
Make a Good Pot of Coffee - Brewing the Coffee,Press the start button and wait for up to 12 minutes,0,1,0,0,1037
Sharpen a Swiss Army Knife - Finishing Up,Dry the blade,1,1,1,1,1038
Convert MediaWiki to WordPress," Prepare for your WordPress migration, to make everything properly",1,1,1,1,1039
Preserve a Butterfly - Mounting Your Butterfly,Set the butterfly’s body in the spreading board,1,2,1,1,1041
Boil Cabbage - Preparing the Cabbage,Cut your cabbage,1,1,1,1,1042
Use Instacart on an iPhone or iPad," Find the ""Cart""  icon at the top right corner of every tab's page",0,0,0,0,1043
Buy a Harley Davidson - Considering a Used Harley-Davidson,Familiarize yourself with Harley-Davidson bikes of recent decades,1,0,1,1,1044
Make a Care Package for a Long Distance Partner - Assembling the Care Package,Decorate the interior of the box,1,1,0,1,1045
Make Caramel Frosting - Making Classic Caramel Frosting,Add the brown sugar into the pan and stir,1,1,1,1,1046
Use a GoPhone Plan With an iPhone - iPhone through iPhone 3GS,Enable wireless data,0,0,0,0,1048
Identify Songs Using Melody - Using Technology,Record yourself humming the melody,1,1,1,1,1049
Collect Rainwater for Drinking - Filtering the Rainwater,Test the rainwater every 1–2 months for pollutants and bacteria,1,2,0,1,1050
Hide Your Profile Picture on Facebook - Using a Computer,Click the Albums tab on the Photos page,0,0,0,0,1051
Do a Pour Painting - Finishing Your Painting,Store the painting so it's completely level,1,1,1,1,1053
Talk About Daily Stress with Your Partner - Having Daily Conversations,Ask your partner how they feel.,1,1,1,1,1054
Update Your Browser - Updating Apple Safari on Mac OS X,Click on the “Update” button next to the Safari update,1,1,1,1,1055
Delete a YouTube Account - Deleting Accounts,"Click ""Remove selected services""",1,1,1,1,1056
Download Google Docs - On Desktop,Choose a file type which you want relevant,1,1,1,1,1057
Hug Your Boyfriend - Hugging Your Boyfriend Properly,Hug your boyfriend differently than you would hug your friend,0,0,0,0,1058
Pack Pants - Folding Pants,Lay the pants on a flat surface,0,0,1,0,1059
Arrange Silk Flowers - Creating Your Floral Arrangement,Arrange smaller flowers around the larger ones,0,0,0,0,1060
Pressure Wash Vinyl Siding - Spraying on the Cleaning Solution,Hold the nozzle straight or at a slight downward angle at all times,0,1,0,0,1061
Play With Your Hermit Crab - Handling Your Hermit Crab,Pick up your hermit crab by the shell,1,1,1,1,1062
Clear Your Browser's Cache - Firefox on Desktop," Click the ""Details"" drop-down box",0,0,0,0,1063
Post Process Smoke Images - Mirroring Your Smoke,Adjust brightness and contrast,1,1,1,1,1064
"Make a Plaster Cast of a Footwear Mark, Tyre Impression or Animal Footprint",Pour the casting material from one end or side of the impression and allow it to flow along the impression,1,1,1,1,1065
Use Excel - Creating Charts,Set up the chart's data,1,1,1,1,1066
Report Visa Violations - Reporting a Visa Holder,Gather information,1,1,1,1,1067
Stain Wood Filler - Applying the Stain,Remove the wood stain if it’s too dark,0,1,0,0,1068
Download Google Docs - On Desktop,Click a format,0,-1,1,0,1069
Use Your Android As Your Workout Trainer - Using My Coach - Workout Trainer,Select another workout,0,0,0,0,1070
Wind a Grandfather Clock - Winding a Chain-Wound Clock,Gently pull on one of the chains,1,1,1,1,1071
"Make a Plaster Cast of a Footwear Mark, Tyre Impression or Animal Footprint",Allow it to dry overnight once the cast has been cleaned,1,1,1,1,1073
Cook Freekeh - Freekeh Pilaf,Let stand,0,0,0,0,1074
Apply for a Job in Canada - Applying and Interviewing,first of all Update your CV and then Choose Which Companies You Want to Apply for,1,2,1,1,1075
Cite a Website with No Author - MLA,Use a shortened version of the name for in-text citations,1,2,1,1,1076
Feather Your Hair - Prepping Your Hair,Wash and part your hair,1,2,1,1,1077
Make a Pumpkin Cake - Vegan Pumpkin Cake,Prepare to make the cake,1,1,1,1,1078
Calculate the Volume of a Cube - Finding Volume from Surface Area,Set up the formula for surface area of a cube.,1,1,1,1,1082
Control Notifications on Periscope - Configuring Periscope’s Notifications Settings on iOS,Tap the Settings app on your iPhone,1,1,1,1,1084
Make a Good Pot of Coffee - Brewing the Coffee,Add cold water to the reservoir on the coffee maker,1,0,1,1,1085
Format FAT32 - Windows (Drives 32 GB and Smaller),""" Select ""FAT32"" from the ""File system"" menu",1,2,1,1,1086
"Cut a Cabbage Into Wedges - Cutting Long, Skinny Cabbage",Sharpen your knife,0,0,0,0,1087
Prune Citrus Trees - Tailoring Your Pruning,Aim to remove 20% of the total canopy,1,2,1,1,1088
Teach a Child to Use the Telephone,Write out a list of phone numbers for your child to use,1,1,1,1,1090
Cut Tile Backsplash - Cutting Installed Tiles," Cut along the top, bottom, and side edges",1,1,1,1,1091
Make Dr. Pepper - Shortcut Dr Pepper,Stir the mixture and give it a taste test,1,1,1,1,1093
Cook Goose Breasts - Pan-Roasted Goose Breasts,Put the skillet in the oven and roast the breasts for 15 minutes,1,1,0,1,1094
Plant Seeds in a Basic Seed Tray - Caring for Your Seedlings,Store the tray in a warm area,1,1,1,1,1095
Sign Up for a US Trusted Traveler Program - Signing up for NEXUS,Wait for your card,1,1,1,1,1096
